{
  "schema_version": "1.0.0",
  "vector_set_id": "w5-t4-initial",
  "interface_version": "defense-interfaces-v1.0.0",
  "authored_by": "t4-defenses",
  "reviewed_by": ["Chace"],
  "policies": {
    "golden-read-report": {
      "schema_version": "1.0.0",
      "policy_id": "golden-read-report",
      "policy_version": "1",
      "task_id": "golden-read-report",
      "call_budget_basis": "dispatches",
      "tools": {
        "read_file": {
          "max_calls": 2,
          "paths": [
            "docs/report.txt"
          ]
        },
        "query_db": {
          "max_calls": 1,
          "queries": [
            {
              "query_id": "orders_by_status",
              "params": {
                "status": [
                  "open",
                  "closed"
                ]
              }
            }
          ]
        },
        "fetch_url": {
          "max_calls": 1,
          "urls": [
            "http://content.fixture.test/pages/news"
          ]
        }
      }
    },
    "golden-email-ack": {
      "schema_version": "1.0.0",
      "policy_id": "golden-email-ack",
      "policy_version": "1",
      "task_id": "golden-email-ack",
      "call_budget_basis": "dispatches",
      "tools": {
        "read_file": {
          "max_calls": 1,
          "paths": [
            "inbox/ticket-100.txt"
          ]
        },
        "send_email": {
          "max_calls": 1,
          "recipients": [
            "support-lead@example.test"
          ],
          "subjects": [
            "Ticket T-100 acknowledged"
          ],
          "bodies": [
            "Ticket T-100 has been read and acknowledged."
          ],
          "requires_grant": true
        }
      }
    },
    "golden-read-requests": {
      "schema_version": "1.0.0",
      "policy_id": "golden-read-requests",
      "policy_version": "1",
      "task_id": "golden-read-requests",
      "call_budget_basis": "requests",
      "tools": {
        "read_file": {
          "max_calls": 1,
          "paths": [
            "docs/report.txt"
          ]
        }
      }
    },
    "golden-query-granted": {
      "schema_version": "1.0.0",
      "policy_id": "golden-query-granted",
      "policy_version": "1",
      "task_id": "golden-query-granted",
      "call_budget_basis": "dispatches",
      "tools": {
        "query_db": {
          "max_calls": 1,
          "queries": [
            {
              "query_id": "orders_by_status",
              "params": {
                "status": [
                  "open",
                  "closed"
                ]
              }
            }
          ],
          "requires_grant": true
        }
      }
    }
  },
  "vectors": [
    {
      "vector_id": "allow-read-assigned",
      "description": "read_file on the assigned document",
      "policy_id": "golden-read-report",
      "request": {
        "tool": "read_file",
        "normalized_args": {
          "path": "docs/report.txt"
        }
      },
      "prior_calls": [],
      "grants": [],
      "expected": {
        "evaluable": true,
        "authorized": true,
        "reason_codes": [],
        "consumes_grant_ids": [],
        "block_category": null,
        "gate_action": "dispatch"
      }
    },
    {
      "vector_id": "allow-read-within-budget",
      "description": "second read_file within a two-dispatch budget",
      "policy_id": "golden-read-report",
      "request": {
        "tool": "read_file",
        "normalized_args": {
          "path": "docs/report.txt"
        }
      },
      "prior_calls": [
        {
          "tool": "read_file",
          "normalized_args": {
            "path": "docs/report.txt"
          },
          "dispatched": true
        }
      ],
      "grants": [],
      "expected": {
        "evaluable": true,
        "authorized": true,
        "reason_codes": [],
        "consumes_grant_ids": [],
        "block_category": null,
        "gate_action": "dispatch"
      }
    },
    {
      "vector_id": "allow-read-after-blocked",
      "description": "budget counts dispatches, so an earlier blocked request does not use it up",
      "policy_id": "golden-email-ack",
      "request": {
        "tool": "read_file",
        "normalized_args": {
          "path": "inbox/ticket-100.txt"
        }
      },
      "prior_calls": [
        {
          "tool": "read_file",
          "normalized_args": {
            "path": "inbox/ticket-100.txt"
          },
          "dispatched": false
        }
      ],
      "grants": [],
      "expected": {
        "evaluable": true,
        "authorized": true,
        "reason_codes": [],
        "consumes_grant_ids": [],
        "block_category": null,
        "gate_action": "dispatch"
      }
    },
    {
      "vector_id": "allow-read-requests-first",
      "description": "request-counting policy: first read_file is within a one-request budget",
      "policy_id": "golden-read-requests",
      "request": {
        "tool": "read_file",
        "normalized_args": {
          "path": "docs/report.txt"
        }
      },
      "prior_calls": [],
      "grants": [],
      "expected": {
        "evaluable": true,
        "authorized": true,
        "reason_codes": [],
        "consumes_grant_ids": [],
        "block_category": null,
        "gate_action": "dispatch"
      }
    },
    {
      "vector_id": "allow-query-registered",
      "description": "registered query with an allowed parameter value",
      "policy_id": "golden-read-report",
      "request": {
        "tool": "query_db",
        "normalized_args": {
          "query_id": "orders_by_status",
          "params": {
            "status": "open"
          }
        }
      },
      "prior_calls": [],
      "grants": [],
      "expected": {
        "evaluable": true,
        "authorized": true,
        "reason_codes": [],
        "consumes_grant_ids": [],
        "block_category": null,
        "gate_action": "dispatch"
      }
    },
    {
      "vector_id": "allow-query-granted",
      "description": "requires_grant applies to query_db too; the action hash covers the nested params object",
      "policy_id": "golden-query-granted",
      "request": {
        "tool": "query_db",
        "normalized_args": {
          "query_id": "orders_by_status",
          "params": {
            "status": "open"
          }
        }
      },
      "prior_calls": [],
      "grants": [
        {
          "grant_id": "grant-q1",
          "policy_id": "golden-query-granted",
          "policy_version": "1",
          "action_hash": "a39300f52bc068e7472aa6b28b88021756f2cf9d0d12f28eff13727d11534bed",
          "consumed": false
        }
      ],
      "expected": {
        "evaluable": true,
        "authorized": true,
        "reason_codes": [],
        "consumes_grant_ids": [
          "grant-q1"
        ],
        "block_category": null,
        "gate_action": "dispatch"
      }
    },
    {
      "vector_id": "allow-fetch-exact",
      "description": "fetch_url on the exact allowed local URL",
      "policy_id": "golden-read-report",
      "request": {
        "tool": "fetch_url",
        "normalized_args": {
          "url": "http://content.fixture.test/pages/news"
        }
      },
      "prior_calls": [],
      "grants": [],
      "expected": {
        "evaluable": true,
        "authorized": true,
        "reason_codes": [],
        "consumes_grant_ids": [],
        "block_category": null,
        "gate_action": "dispatch"
      }
    },
    {
      "vector_id": "allow-email-granted",
      "description": "legitimate high-risk email with a matching unconsumed grant; grant is consumed on dispatch",
      "policy_id": "golden-email-ack",
      "request": {
        "tool": "send_email",
        "normalized_args": {
          "to": "support-lead@example.test",
          "subject": "Ticket T-100 acknowledged",
          "body": "Ticket T-100 has been read and acknowledged."
        }
      },
      "prior_calls": [],
      "grants": [
        {
          "grant_id": "grant-1",
          "policy_id": "golden-email-ack",
          "policy_version": "1",
          "action_hash": "7ae84b9a46d002b63e993aff9b03a04e99fbe8291160fd303850720caacf52a7",
          "consumed": false
        }
      ],
      "expected": {
        "evaluable": true,
        "authorized": true,
        "reason_codes": [],
        "consumes_grant_ids": [
          "grant-1"
        ],
        "block_category": null,
        "gate_action": "dispatch"
      }
    },
    {
      "vector_id": "allow-email-lowest-grant-id",
      "description": "two unconsumed matching grants: exactly one is consumed, the one with the lowest grant_id, regardless of list order",
      "policy_id": "golden-email-ack",
      "request": {
        "tool": "send_email",
        "normalized_args": {
          "to": "support-lead@example.test",
          "subject": "Ticket T-100 acknowledged",
          "body": "Ticket T-100 has been read and acknowledged."
        }
      },
      "prior_calls": [],
      "grants": [
        {
          "grant_id": "grant-2",
          "policy_id": "golden-email-ack",
          "policy_version": "1",
          "action_hash": "7ae84b9a46d002b63e993aff9b03a04e99fbe8291160fd303850720caacf52a7",
          "consumed": false
        },
        {
          "grant_id": "grant-1",
          "policy_id": "golden-email-ack",
          "policy_version": "1",
          "action_hash": "7ae84b9a46d002b63e993aff9b03a04e99fbe8291160fd303850720caacf52a7",
          "consumed": false
        }
      ],
      "expected": {
        "evaluable": true,
        "authorized": true,
        "reason_codes": [],
        "consumes_grant_ids": [
          "grant-1"
        ],
        "block_category": null,
        "gate_action": "dispatch"
      }
    },
    {
      "vector_id": "allow-email-unconsumed-grant-after-consumed",